{
  "$schema": "https://schemas.ui.le-mn.com/provider-registry/capability-migration-matrix/v1.json",
  "schemaVersion": 1,
  "matrixId": "lemn-ui-provider-first-cutover",
  "catalogCount": 131,
  "targetPackage": "@lemn-ltd/ui",
  "targetPackageVersion": "0.3.0",
  "capabilities": [
    {
      "catalogSlug": "button",
      "capabilityId": "ui.core.button",
      "finalCapabilityId": "ui.core.button",
      "finalPublicExports": [
        "Button"
      ],
      "disposition": "native-with-rationale",
      "nativeRationale": "Button remains a LEMN-owned primitives capability because its product-neutral composition is specific to the shared catalog and no accepted upstream provider owns this exact semantic contract.",
      "migration": {
        "status": "complete",
        "publicVersionEffect": "minor",
        "targetPackageVersion": "0.3.0",
        "summary": "Retain Button as reviewed native LEMN behavior in the 0.3.0 cutover."
      },
      "conformanceProof": [
        "packages/ui/src/primitives/button/tests/button.spec.tsx",
        "packages/ui/src/tests/catalog.spec.ts"
      ]
    },
    {
      "catalogSlug": "icon-button",
      "capabilityId": "ui.core.icon-button",
      "finalCapabilityId": "ui.core.icon-button",
      "finalPublicExports": [
        "IconButton"
      ],
      "disposition": "native-with-rationale",
      "nativeRationale": "Icon button remains a LEMN-owned primitives capability because its product-neutral composition is specific to the shared catalog and no accepted upstream provider owns this exact semantic contract.",
      "migration": {
        "status": "complete",
        "publicVersionEffect": "minor",
        "targetPackageVersion": "0.3.0",
        "summary": "Retain IconButton as reviewed native LEMN behavior in the 0.3.0 cutover."
      },
      "conformanceProof": [
        "packages/ui/src/primitives/icon-button/tests/icon-button.spec.tsx",
        "packages/ui/src/tests/catalog.spec.ts"
      ]
    },
    {
      "catalogSlug": "scroll-to-bottom-button",
      "capabilityId": "ui.core.scroll-to-bottom-button",
      "finalCapabilityId": "ui.core.scroll-to-bottom-button",
      "finalPublicExports": [
        "ScrollToBottomButton"
      ],
      "disposition": "native-with-rationale",
      "nativeRationale": "Scroll to bottom button remains a LEMN-owned primitives capability because its product-neutral composition is specific to the shared catalog and no accepted upstream provider owns this exact semantic contract.",
      "migration": {
        "status": "complete",
        "publicVersionEffect": "minor",
        "targetPackageVersion": "0.3.0",
        "summary": "Retain ScrollToBottomButton as reviewed native LEMN behavior in the 0.3.0 cutover."
      },
      "conformanceProof": [
        "packages/ui/src/primitives/scroll-to-bottom-button/tests/scroll-to-bottom-button.spec.tsx",
        "packages/ui/src/tests/catalog.spec.ts"
      ]
    },
    {
      "catalogSlug": "input",
      "capabilityId": "ui.core.input",
      "finalCapabilityId": "ui.core.input",
      "finalPublicExports": [
        "Input"
      ],
      "disposition": "native-with-rationale",
      "nativeRationale": "Input remains a LEMN-owned inputs capability because its product-neutral composition is specific to the shared catalog and no accepted upstream provider owns this exact semantic contract.",
      "migration": {
        "status": "complete",
        "publicVersionEffect": "minor",
        "targetPackageVersion": "0.3.0",
        "summary": "Retain Input as reviewed native LEMN behavior in the 0.3.0 cutover."
      },
      "conformanceProof": [
        "packages/ui/src/primitives/input/tests/input.spec.tsx",
        "packages/ui/src/tests/catalog.spec.ts"
      ]
    },
    {
      "catalogSlug": "textarea",
      "capabilityId": "ui.core.textarea",
      "finalCapabilityId": "ui.core.textarea",
      "finalPublicExports": [
        "Textarea"
      ],
      "disposition": "native-with-rationale",
      "nativeRationale": "Textarea remains a LEMN-owned inputs capability because its product-neutral composition is specific to the shared catalog and no accepted upstream provider owns this exact semantic contract.",
      "migration": {
        "status": "complete",
        "publicVersionEffect": "minor",
        "targetPackageVersion": "0.3.0",
        "summary": "Retain Textarea as reviewed native LEMN behavior in the 0.3.0 cutover."
      },
      "conformanceProof": [
        "packages/ui/src/primitives/textarea/tests/textarea.spec.tsx",
        "packages/ui/src/tests/catalog.spec.ts"
      ]
    },
    {
      "catalogSlug": "select",
      "capabilityId": "ui.core.select",
      "finalCapabilityId": "ui.core.select",
      "finalPublicExports": [
        "InputSelect"
      ],
      "disposition": "keep-provider-backed",
      "provider": {
        "implementationId": "radix-ui.select@1.4.3",
        "id": "radix-ui",
        "name": "Radix UI",
        "repository": "https://github.com/radix-ui/primitives",
        "ingestionMode": "runtime_dependency",
        "packageName": "radix-ui",
        "packageVersion": "1.4.3",
        "packageIntegrity": "sha512-aWizCQiyeAenIdUbqEpXgRA1ya65P13NKn/W8rWkcN0OPkRDxdBVLWnIEDsS2RpwCK2nobI7oMUSmexzTDyAmA=="
      },
      "migration": {
        "status": "complete",
        "publicVersionEffect": "minor",
        "targetPackageVersion": "0.3.0",
        "summary": "Retain InputSelect behind a provider-neutral LEMN adapter in the 0.3.0 cutover."
      },
      "conformanceProof": [
        "packages/ui/src/primitives/input-select/tests/input-select.spec.tsx",
        "packages/ui/src/tests/catalog.spec.ts"
      ]
    },
    {
      "catalogSlug": "search",
      "capabilityId": "ui.core.search",
      "finalCapabilityId": "ui.core.search",
      "finalPublicExports": [
        "InputSearch"
      ],
      "disposition": "native-with-rationale",
      "nativeRationale": "Search remains a LEMN-owned inputs capability because its product-neutral composition is specific to the shared catalog and no accepted upstream provider owns this exact semantic contract.",
      "migration": {
        "status": "complete",
        "publicVersionEffect": "minor",
        "targetPackageVersion": "0.3.0",
        "summary": "Retain InputSearch as reviewed native LEMN behavior in the 0.3.0 cutover."
      },
      "conformanceProof": [
        "packages/ui/src/primitives/input-search/tests/input-search.spec.tsx",
        "packages/ui/src/tests/catalog.spec.ts"
      ]
    },
    {
      "catalogSlug": "checkbox",
      "capabilityId": "ui.primitive.checkbox",
      "finalCapabilityId": "ui.primitive.checkbox",
      "finalPublicExports": [
        "Checkbox"
      ],
      "disposition": "keep-provider-backed",
      "provider": {
        "implementationId": "radix-ui.checkbox@1.4.3",
        "id": "radix-ui",
        "name": "Radix UI",
        "repository": "https://github.com/radix-ui/primitives",
        "ingestionMode": "runtime_dependency",
        "packageName": "radix-ui",
        "packageVersion": "1.4.3",
        "packageIntegrity": "sha512-aWizCQiyeAenIdUbqEpXgRA1ya65P13NKn/W8rWkcN0OPkRDxdBVLWnIEDsS2RpwCK2nobI7oMUSmexzTDyAmA=="
      },
      "migration": {
        "status": "complete",
        "publicVersionEffect": "minor",
        "targetPackageVersion": "0.3.0",
        "summary": "Retain Checkbox behind a provider-neutral LEMN adapter in the 0.3.0 cutover."
      },
      "conformanceProof": [
        "packages/ui/src/primitives/checkbox/tests/checkbox.spec.tsx",
        "packages/ui/src/tests/catalog.spec.ts"
      ]
    },
    {
      "catalogSlug": "radio",
      "capabilityId": "ui.core.radio",
      "finalCapabilityId": "ui.core.radio",
      "finalPublicExports": [
        "RadioGroup",
        "RadioGroupItem"
      ],
      "disposition": "keep-provider-backed",
      "provider": {
        "implementationId": "radix-ui.radio@1.4.3",
        "id": "radix-ui",
        "name": "Radix UI",
        "repository": "https://github.com/radix-ui/primitives",
        "ingestionMode": "runtime_dependency",
        "packageName": "radix-ui",
        "packageVersion": "1.4.3",
        "packageIntegrity": "sha512-aWizCQiyeAenIdUbqEpXgRA1ya65P13NKn/W8rWkcN0OPkRDxdBVLWnIEDsS2RpwCK2nobI7oMUSmexzTDyAmA=="
      },
      "migration": {
        "status": "complete",
        "publicVersionEffect": "minor",
        "targetPackageVersion": "0.3.0",
        "summary": "Retain RadioGroup, RadioGroupItem behind a provider-neutral LEMN adapter in the 0.3.0 cutover."
      },
      "conformanceProof": [
        "packages/ui/src/primitives/radio/tests/radio.spec.tsx",
        "packages/ui/src/tests/catalog.spec.ts"
      ]
    },
    {
      "catalogSlug": "toggle",
      "capabilityId": "ui.core.toggle",
      "finalCapabilityId": "ui.core.toggle",
      "finalPublicExports": [
        "Toggle"
      ],
      "disposition": "keep-provider-backed",
      "provider": {
        "implementationId": "radix-ui.toggle@1.4.3",
        "id": "radix-ui",
        "name": "Radix UI",
        "repository": "https://github.com/radix-ui/primitives",
        "ingestionMode": "runtime_dependency",
        "packageName": "radix-ui",
        "packageVersion": "1.4.3",
        "packageIntegrity": "sha512-aWizCQiyeAenIdUbqEpXgRA1ya65P13NKn/W8rWkcN0OPkRDxdBVLWnIEDsS2RpwCK2nobI7oMUSmexzTDyAmA=="
      },
      "migration": {
        "status": "complete",
        "publicVersionEffect": "minor",
        "targetPackageVersion": "0.3.0",
        "summary": "Retain Toggle behind a provider-neutral LEMN adapter in the 0.3.0 cutover."
      },
      "conformanceProof": [
        "packages/ui/src/primitives/toggle/tests/toggle.spec.tsx",
        "packages/ui/src/tests/catalog.spec.ts"
      ]
    },
    {
      "catalogSlug": "badge",
      "capabilityId": "ui.core.badge",
      "finalCapabilityId": "ui.core.badge",
      "finalPublicExports": [
        "Badge"
      ],